{
  "authority": {
    "allowed_paths": [
      "AGENTS.md",
      "docs",
      "docs/codex",
      "docs/codex/MIGRATIONS",
      "docs/codex/MIGRATIONS/.coordinator.lock",
      "docs/codex/MIGRATIONS/20260824T151610Z-ba40c67d-ef6d-46dc-bf92-bbcd1cac8139.journal.json",
      "docs/codex/MIGRATIONS/20260824T151610Z-ba40c67d-ef6d-46dc-bf92-bbcd1cac8139.report.md",
      "docs/codex/STANDARD.json",
      "docs/codex/WORK_ITEMS"
    ],
    "command": "upgrade",
    "created_at": "2026-08-24T15:16:10Z",
    "decisions": [],
    "mutation_classes": [
      "coordinator-layer",
      "sequential-safe-migration",
      "run-metadata"
    ],
    "source_id": "current-task:user-request"
  },
  "command": "upgrade",
  "created_at": "2026-08-24T15:16:10Z",
  "file_hashes": [
    {
      "after_sha256": "36ef318733ef594724483ce172290fea6e8fea9dc6639c201aa39b33cbf353b6",
      "before_sha256": "f93de691f1c003561c0538df24b16a0a4c19a50283430c02f6376bcc5bc8188d",
      "relative_path": "AGENTS.md"
    },
    {
      "after_sha256": "c0f7ab6b6faa26abc41bbd3e0174c47db565368aeb39d64410859dc16ae631b9",
      "before_sha256": "520ee10e238d418001676bd48185ff7099cd56bb09fa40fd681a3d548ae2a7e4",
      "relative_path": "docs/codex/STANDARD.json"
    },
    {
      "after_sha256": "3c70d250d27cb2473964ecacb39cd2a0e353b63b21693c2a640946ef9a21cbb4",
      "before_sha256": null,
      "relative_path": "docs/codex/MIGRATIONS/20260824T151610Z-ba40c67d-ef6d-46dc-bf92-bbcd1cac8139.report.md"
    }
  ],
  "next_action": "Continue normal coordination and keep STATUS current at meaningful checkpoints.",
  "phase_history": [
    {
      "at": "2026-08-24T15:16:10Z",
      "evidence": [
        "repo_kind=\"linked-worktree\""
      ],
      "phase": "inspect"
    },
    {
      "at": "2026-08-24T15:16:10Z",
      "evidence": [
        "operation_count=3"
      ],
      "phase": "plan"
    },
    {
      "at": "2026-08-24T15:16:10Z",
      "evidence": [
        "written_files=3"
      ],
      "phase": "apply"
    },
    {
      "at": "2026-08-24T15:16:10Z",
      "evidence": [
        "checks=43"
      ],
      "phase": "validate"
    },
    {
      "at": "2026-08-24T15:16:10Z",
      "evidence": [
        "report_path=\"docs/codex/MIGRATIONS/20260824T151610Z-ba40c67d-ef6d-46dc-bf92-bbcd1cac8139.report.md\""
      ],
      "phase": "finalize"
    }
  ],
  "planned_operations": [
    {
      "action": "replace",
      "after_sha256": "36ef318733ef594724483ce172290fea6e8fea9dc6639c201aa39b33cbf353b6",
      "before_sha256": "f93de691f1c003561c0538df24b16a0a4c19a50283430c02f6376bcc5bc8188d",
      "relative_path": "AGENTS.md",
      "reversal": {
        "kind": "restore-git-base",
        "metadata": [
          {
            "name": "before_sha256",
            "value": "f93de691f1c003561c0538df24b16a0a4c19a50283430c02f6376bcc5bc8188d"
          }
        ],
        "reference": "48a877b7b9a6b707ffc923771ccaf8b7c024995c"
      }
    },
    {
      "action": "replace",
      "after_sha256": "c0f7ab6b6faa26abc41bbd3e0174c47db565368aeb39d64410859dc16ae631b9",
      "before_sha256": "520ee10e238d418001676bd48185ff7099cd56bb09fa40fd681a3d548ae2a7e4",
      "relative_path": "docs/codex/STANDARD.json",
      "reversal": {
        "kind": "restore-git-base",
        "metadata": [
          {
            "name": "before_sha256",
            "value": "520ee10e238d418001676bd48185ff7099cd56bb09fa40fd681a3d548ae2a7e4"
          }
        ],
        "reference": "48a877b7b9a6b707ffc923771ccaf8b7c024995c"
      }
    },
    {
      "action": "create",
      "after_sha256": "3c70d250d27cb2473964ecacb39cd2a0e353b63b21693c2a640946ef9a21cbb4",
      "before_sha256": null,
      "relative_path": "docs/codex/MIGRATIONS/20260824T151610Z-ba40c67d-ef6d-46dc-bf92-bbcd1cac8139.report.md",
      "reversal": {
        "kind": "delete-new",
        "metadata": [],
        "reference": null
      }
    }
  ],
  "post_apply_git": {
    "branch": "codex/routing-policy-0.3.0",
    "common_dir_identity_sha256": "052e767eb8545526267ec16417774c71ca50fd772414110a4918c6b4914eb80f",
    "explicit_base": "48a877b7b9a6b707ffc923771ccaf8b7c024995c",
    "head": "48a877b7b9a6b707ffc923771ccaf8b7c024995c",
    "is_detached": false,
    "kind": "linked-worktree",
    "staged_managed_paths": [],
    "unstaged_managed_paths": [
      "AGENTS.md",
      "docs/codex/STANDARD.json"
    ],
    "untracked_managed_paths": [
      "docs/codex/MIGRATIONS/.coordinator.lock",
      "docs/codex/MIGRATIONS/20260824T151610Z-ba40c67d-ef6d-46dc-bf92-bbcd1cac8139.journal.json",
      "docs/codex/MIGRATIONS/20260824T151610Z-ba40c67d-ef6d-46dc-bf92-bbcd1cac8139.report.md"
    ],
    "worktree_identity_sha256": "d2ae8d2bbe722cfc727d03bed38c2f681fef2247198912f2173ad1d3199182a9"
  },
  "project_slug": "cody",
  "report_path": "docs/codex/MIGRATIONS/20260824T151610Z-ba40c67d-ef6d-46dc-bf92-bbcd1cac8139.report.md",
  "report_sha256": "3c70d250d27cb2473964ecacb39cd2a0e353b63b21693c2a640946ef9a21cbb4",
  "repository_identity": {
    "basename": "checkout",
    "fingerprint": "5f357fb3eecf0696022522b3682e24d71563f6ba7012dc98c6ae6c53712d1369",
    "project_id": "b0899bb2-17be-421b-a1b8-6be2325e1646",
    "provisional": false
  },
  "run_id": "ba40c67d-ef6d-46dc-bf92-bbcd1cac8139",
  "schema_version": 1,
  "source_files": [
    {
      "disposition": "normalized-in-place",
      "relative_path": "AGENTS.md",
      "sha256": "f93de691f1c003561c0538df24b16a0a4c19a50283430c02f6376bcc5bc8188d"
    },
    {
      "disposition": "normalized-in-place",
      "relative_path": "docs/codex/STANDARD.json",
      "sha256": "520ee10e238d418001676bd48185ff7099cd56bb09fa40fd681a3d548ae2a7e4"
    }
  ],
  "standard_name": "cody-coordinator",
  "standard_version": "0.3.0",
  "starting_git": {
    "branch": "codex/routing-policy-0.3.0",
    "common_dir_identity_sha256": "052e767eb8545526267ec16417774c71ca50fd772414110a4918c6b4914eb80f",
    "explicit_base": "48a877b7b9a6b707ffc923771ccaf8b7c024995c",
    "head": "48a877b7b9a6b707ffc923771ccaf8b7c024995c",
    "is_detached": false,
    "kind": "linked-worktree",
    "staged_managed_paths": [],
    "unstaged_managed_paths": [],
    "untracked_managed_paths": [],
    "worktree_identity_sha256": "d2ae8d2bbe722cfc727d03bed38c2f681fef2247198912f2173ad1d3199182a9"
  },
  "status": "complete",
  "updated_at": "2026-08-24T15:16:10Z",
  "validation": [
    {
      "message": "Repository and managed paths are safe regular locations.",
      "name": "repository-safety",
      "ok": true,
      "severity": "P0"
    },
    {
      "message": "Bundled schemas use only the documented dependency-free subset.",
      "name": "supported-schema-subset",
      "ok": true,
      "severity": "P1"
    },
    {
      "message": "STANDARD.json matches the bundled identity schema.",
      "name": "standard-schema",
      "ok": true,
      "severity": "P1"
    },
    {
      "message": "AGENTS.md contains one current, well-formed managed block.",
      "name": "managed-marker-integrity",
      "ok": true,
      "severity": "P1"
    },
    {
      "message": "Required coordinator path AGENTS.md is present and regular.",
      "name": "required-path:AGENTS.md",
      "ok": true,
      "severity": "P1"
    },
    {
      "message": "Required coordinator path docs/codex/STANDARD.json is present and regular.",
      "name": "required-path:docs/codex/STANDARD.json",
      "ok": true,
      "severity": "P1"
    },
    {
      "message": "Required coordinator path docs/codex/PROJECT.md is present and regular.",
      "name": "required-path:docs/codex/PROJECT.md",
      "ok": true,
      "severity": "P1"
    },
    {
      "message": "Required coordinator path docs/codex/STATUS.md is present and regular.",
      "name": "required-path:docs/codex/STATUS.md",
      "ok": true,
      "severity": "P1"
    },
    {
      "message": "Required coordinator path docs/codex/ROADMAP.md is present and regular.",
      "name": "required-path:docs/codex/ROADMAP.md",
      "ok": true,
      "severity": "P1"
    },
    {
      "message": "Required coordinator path docs/codex/DECISIONS.md is present and regular.",
      "name": "required-path:docs/codex/DECISIONS.md",
      "ok": true,
      "severity": "P1"
    },
    {
      "message": "PROJECT.md contains every required durable section.",
      "name": "required-sections:PROJECT.md",
      "ok": true,
      "severity": "P1"
    },
    {
      "message": "ROADMAP.md contains every required durable section.",
      "name": "required-sections:ROADMAP.md",
      "ok": true,
      "severity": "P1"
    },
    {
      "message": "DECISIONS.md contains every required durable section.",
      "name": "required-sections:DECISIONS.md",
      "ok": true,
      "severity": "P1"
    },
    {
      "message": "STATUS.md contains the current compact contract or the preserved 3.1 contract.",
      "name": "required-sections:STATUS.md",
      "ok": true,
      "severity": "P1"
    },
    {
      "message": "STATUS.md stays at or below the approximate 2,000-token recovery target.",
      "name": "status-compactness",
      "ok": true,
      "severity": "P1"
    },
    {
      "message": "The STANDARD.json has no unresolved template placeholders.",
      "name": "template-placeholders:STANDARD.json",
      "ok": true,
      "severity": "P1"
    },
    {
      "message": "The STANDARD.json has no serialized personal or absolute filesystem path.",
      "name": "personal-or-absolute-path:STANDARD.json",
      "ok": true,
      "severity": "P1"
    },
    {
      "message": "The PROJECT.md has no unresolved template placeholders.",
      "name": "template-placeholders:PROJECT.md",
      "ok": true,
      "severity": "P1"
    },
    {
      "message": "The PROJECT.md has no serialized personal or absolute filesystem path.",
      "name": "personal-or-absolute-path:PROJECT.md",
      "ok": true,
      "severity": "P1"
    },
    {
      "message": "The STATUS.md has no unresolved template placeholders.",